{
  "$schema": "https://json-schema.org/draft/2020-12/schema",
  "$id": "https://github.com/alexzhang1030/rclweb/docs/evidence/schema/qualification-report-v1.json",
  "title": "rclweb qualification report v1",
  "description": "Closed machine-readable qualification evidence contract for rclweb gates. Generated from scripts/evidence-schema.ts using constants in evidence-model.ts; the Bun checker enforces the same constants plus ordering, calendar, filesystem, and integrity checks.",
  "type": "object",
  "additionalProperties": false,
  "required": [
    "schema_version",
    "report_id",
    "gate",
    "evidence_level",
    "identity",
    "invocation",
    "artifacts",
    "measurements",
    "review"
  ],
  "properties": {
    "schema_version": {
      "type": "integer",
      "const": 1
    },
    "report_id": {
      "type": "string",
      "const": "rclweb-qualification-report-v1"
    },
    "gate": {
      "type": "string",
      "enum": [
        "R0",
        "R1",
        "R2",
        "R3",
        "R4",
        "U0",
        "X0"
      ]
    },
    "evidence_level": {
      "type": "string",
      "enum": [
        "foundation",
        "N1",
        "N2",
        "N3",
        "operations",
        "security",
        "prototype"
      ]
    },
    "identity": {
      "type": "object",
      "additionalProperties": false,
      "required": [
        "code_revision",
        "fixture_manifests",
        "package_versions",
        "image_digests",
        "environment"
      ],
      "properties": {
        "code_revision": {
          "type": "string",
          "pattern": "^[0-9a-f]{40}$"
        },
        "fixture_manifests": {
          "type": "object",
          "minProperties": 1,
          "maxProperties": 32,
          "propertyNames": {
            "type": "string",
            "minLength": 1,
            "maxLength": 64,
            "pattern": "^[A-Za-z0-9][A-Za-z0-9._-]{0,63}$"
          },
          "additionalProperties": {
            "type": "string",
            "pattern": "^[0-9a-f]{64}$"
          }
        },
        "package_versions": {
          "type": "object",
          "minProperties": 1,
          "maxProperties": 64,
          "propertyNames": {
            "type": "string",
            "minLength": 1,
            "maxLength": 128,
            "pattern": "^[A-Za-z0-9][A-Za-z0-9._+/-]*$"
          },
          "additionalProperties": {
            "type": "string",
            "minLength": 1,
            "maxLength": 256
          }
        },
        "image_digests": {
          "type": "object",
          "minProperties": 0,
          "maxProperties": 32,
          "propertyNames": {
            "type": "string",
            "minLength": 1,
            "maxLength": 128
          },
          "additionalProperties": {
            "type": "string",
            "pattern": "^sha256:[0-9a-f]{64}$"
          }
        },
        "environment": {
          "type": "object",
          "additionalProperties": false,
          "required": [
            "environment_id",
            "platform",
            "toolchain"
          ],
          "properties": {
            "environment_id": {
              "type": "string",
              "pattern": "^[A-Za-z0-9][A-Za-z0-9._:-]{0,127}$"
            },
            "platform": {
              "type": "string",
              "enum": [
                "linux/arm64",
                "linux/amd64",
                "darwin/arm64",
                "darwin/amd64"
              ]
            },
            "toolchain": {
              "type": "object",
              "minProperties": 1,
              "maxProperties": 16,
              "propertyNames": {
                "type": "string",
                "minLength": 1,
                "maxLength": 64
              },
              "additionalProperties": {
                "type": "string",
                "minLength": 1,
                "maxLength": 128
              }
            },
            "attributes": {
              "type": "object",
              "minProperties": 0,
              "maxProperties": 32,
              "propertyNames": {
                "type": "string",
                "minLength": 1,
                "maxLength": 64
              },
              "additionalProperties": {
                "type": "string",
                "minLength": 1,
                "maxLength": 256
              }
            }
          }
        }
      }
    },
    "provenance": {
      "type": "object",
      "additionalProperties": false,
      "properties": {
        "support_row_id": {
          "type": "string",
          "enum": [
            "H-FT",
            "H-CY",
            "H-ZN",
            "J-FT",
            "J-CY",
            "J-ZN"
          ]
        },
        "gateway_instance_id": {
          "type": "string",
          "minLength": 1,
          "maxLength": 128
        },
        "domain_ids": {
          "type": "array",
          "minItems": 1,
          "maxItems": 64,
          "uniqueItems": true,
          "items": {
            "type": "integer",
            "minimum": 0,
            "maximum": 232
          }
        },
        "adapter_profile": {
          "type": "string",
          "minLength": 1,
          "maxLength": 128
        }
      }
    },
    "invocation": {
      "type": "object",
      "additionalProperties": false,
      "required": [
        "commands",
        "workload",
        "budgets",
        "duration_seconds",
        "sample_count",
        "warmup_count"
      ],
      "properties": {
        "commands": {
          "type": "array",
          "minItems": 1,
          "maxItems": 64,
          "items": {
            "type": "string",
            "minLength": 1,
            "maxLength": 1024
          }
        },
        "workload": {
          "type": "string",
          "minLength": 1,
          "maxLength": 4096
        },
        "budgets": {
          "type": "object",
          "minProperties": 1,
          "maxProperties": 32,
          "propertyNames": {
            "type": "string",
            "minLength": 1,
            "maxLength": 64
          },
          "additionalProperties": {
            "anyOf": [
              {
                "type": "string",
                "minLength": 1,
                "maxLength": 256
              },
              {
                "type": "number",
                "minimum": -1000000000000000,
                "maximum": 1000000000000000
              },
              {
                "type": "boolean"
              }
            ]
          }
        },
        "duration_seconds": {
          "type": "number",
          "minimum": 0,
          "maximum": 2592000
        },
        "sample_count": {
          "type": "integer",
          "minimum": 0,
          "maximum": 100000000
        },
        "warmup_count": {
          "type": "integer",
          "minimum": 0,
          "maximum": 1000000
        },
        "variance": {
          "type": "string",
          "minLength": 1,
          "maxLength": 1024
        }
      }
    },
    "artifacts": {
      "type": "array",
      "minItems": 1,
      "maxItems": 64,
      "items": {
        "type": "object",
        "additionalProperties": false,
        "required": [
          "role",
          "path",
          "sha256",
          "byte_length",
          "media_type",
          "retention_policy"
        ],
        "properties": {
          "role": {
            "type": "string",
            "enum": [
              "raw",
              "derived",
              "report"
            ]
          },
          "path": {
            "type": "string",
            "minLength": 1,
            "maxLength": 512,
            "pattern": "^[A-Za-z0-9][A-Za-z0-9._-]*(?:/[A-Za-z0-9][A-Za-z0-9._-]*)*$"
          },
          "sha256": {
            "type": "string",
            "pattern": "^[0-9a-f]{64}$"
          },
          "byte_length": {
            "type": "integer",
            "minimum": 0,
            "maximum": 16777216
          },
          "media_type": {
            "type": "string",
            "minLength": 3,
            "maxLength": 128,
            "pattern": "^[a-z0-9][a-z0-9!#$&^_.+-]*\\/[a-z0-9][a-z0-9!#$&^_.+-]*$"
          },
          "retention_policy": {
            "type": "string",
            "minLength": 1,
            "maxLength": 128
          }
        }
      }
    },
    "measurements": {
      "type": "object",
      "additionalProperties": false,
      "required": [
        "errors",
        "dispositions"
      ],
      "properties": {
        "timestamps": {
          "type": "object",
          "maxProperties": 32,
          "propertyNames": {
            "type": "string",
            "minLength": 1,
            "maxLength": 64
          },
          "additionalProperties": {
            "type": "string",
            "minLength": 1,
            "maxLength": 64
          }
        },
        "queues": {
          "type": "object",
          "maxProperties": 32,
          "propertyNames": {
            "type": "string",
            "minLength": 1,
            "maxLength": 64
          },
          "additionalProperties": {
            "anyOf": [
              {
                "type": "string",
                "minLength": 1,
                "maxLength": 256
              },
              {
                "type": "number",
                "minimum": -1000000000000000,
                "maximum": 1000000000000000
              },
              {
                "type": "boolean"
              }
            ]
          }
        },
        "resources": {
          "type": "object",
          "maxProperties": 32,
          "propertyNames": {
            "type": "string",
            "minLength": 1,
            "maxLength": 64
          },
          "additionalProperties": {
            "anyOf": [
              {
                "type": "string",
                "minLength": 1,
                "maxLength": 256
              },
              {
                "type": "number",
                "minimum": -1000000000000000,
                "maximum": 1000000000000000
              },
              {
                "type": "boolean"
              }
            ]
          }
        },
        "errors": {
          "type": "array",
          "maxItems": 256,
          "items": {
            "type": "object",
            "additionalProperties": false,
            "required": [
              "code",
              "message"
            ],
            "properties": {
              "code": {
                "type": "string",
                "minLength": 1,
                "maxLength": 64
              },
              "message": {
                "type": "string",
                "minLength": 1,
                "maxLength": 1024
              }
            }
          }
        },
        "dispositions": {
          "type": "array",
          "maxItems": 256,
          "items": {
            "type": "object",
            "additionalProperties": false,
            "required": [
              "name",
              "count"
            ],
            "properties": {
              "name": {
                "type": "string",
                "minLength": 1,
                "maxLength": 64
              },
              "count": {
                "type": "integer",
                "minimum": 0,
                "maximum": 100000000
              }
            }
          }
        }
      }
    },
    "review": {
      "type": "object",
      "additionalProperties": false,
      "required": [
        "decision",
        "known_limits"
      ],
      "properties": {
        "decision": {
          "type": "string",
          "enum": [
            "pending",
            "accept",
            "reject",
            "provisional"
          ]
        },
        "reviewer": {
          "type": "string",
          "minLength": 1,
          "maxLength": 128
        },
        "decision_date": {
          "type": "string",
          "pattern": "^[0-9]{4}-[0-9]{2}-[0-9]{2}$",
          "format": "date"
        },
        "known_limits": {
          "type": "array",
          "maxItems": 64,
          "items": {
            "type": "string",
            "minLength": 1,
            "maxLength": 1024
          }
        }
      },
      "allOf": [
        {
          "if": {
            "properties": {
              "decision": {
                "const": "pending"
              }
            },
            "required": [
              "decision"
            ]
          },
          "then": {
            "not": {
              "anyOf": [
                {
                  "required": [
                    "reviewer"
                  ]
                },
                {
                  "required": [
                    "decision_date"
                  ]
                }
              ]
            }
          },
          "else": {
            "required": [
              "reviewer",
              "decision_date"
            ]
          }
        }
      ]
    }
  },
  "allOf": [
    {
      "if": {
        "properties": {
          "gate": {
            "const": "R0"
          }
        },
        "required": [
          "gate"
        ]
      },
      "then": {
        "properties": {
          "evidence_level": {
            "enum": [
              "foundation"
            ]
          }
        }
      }
    },
    {
      "if": {
        "properties": {
          "gate": {
            "const": "R1"
          }
        },
        "required": [
          "gate"
        ]
      },
      "then": {
        "properties": {
          "evidence_level": {
            "enum": [
              "foundation",
              "N1"
            ]
          }
        }
      }
    },
    {
      "if": {
        "properties": {
          "gate": {
            "const": "R2"
          }
        },
        "required": [
          "gate"
        ]
      },
      "then": {
        "properties": {
          "evidence_level": {
            "enum": [
              "N1"
            ]
          }
        }
      }
    },
    {
      "if": {
        "properties": {
          "gate": {
            "const": "R3"
          }
        },
        "required": [
          "gate"
        ]
      },
      "then": {
        "properties": {
          "evidence_level": {
            "enum": [
              "N1",
              "N2"
            ]
          }
        }
      }
    },
    {
      "if": {
        "properties": {
          "gate": {
            "const": "R4"
          }
        },
        "required": [
          "gate"
        ]
      },
      "then": {
        "properties": {
          "evidence_level": {
            "enum": [
              "operations",
              "security"
            ]
          }
        }
      }
    },
    {
      "if": {
        "properties": {
          "gate": {
            "const": "U0"
          }
        },
        "required": [
          "gate"
        ]
      },
      "then": {
        "properties": {
          "evidence_level": {
            "enum": [
              "prototype"
            ]
          }
        }
      }
    },
    {
      "if": {
        "properties": {
          "gate": {
            "const": "X0"
          }
        },
        "required": [
          "gate"
        ]
      },
      "then": {
        "properties": {
          "evidence_level": {
            "enum": [
              "N3"
            ]
          }
        }
      }
    },
    {
      "if": {
        "properties": {
          "evidence_level": {
            "enum": [
              "N1",
              "N2"
            ]
          }
        },
        "required": [
          "evidence_level"
        ]
      },
      "then": {
        "required": [
          "provenance"
        ],
        "properties": {
          "provenance": {
            "type": "object",
            "required": [
              "support_row_id"
            ]
          }
        }
      }
    }
  ]
}
