{
  "schema_version": 1,
  "report_id": "rclweb-qualification-report-v1",
  "gate": "R0",
  "evidence_level": "foundation",
  "identity": {
    "code_revision": "917fe99063d73aa32e3da03e5d46c8fac56ab3e5",
    "fixture_manifests": {
      "cdr": "0123456789abcdef0123456789abcdef0123456789abcdef0123456789abcdef",
      "r2wp": "fedcba9876543210fedcba9876543210fedcba9876543210fedcba9876543210"
    },
    "package_versions": {
      "bun": "1.3.14",
      "just": "1.50.0"
    },
    "image_digests": {},
    "environment": {
      "environment_id": "local-foundation-smoke-amd64",
      "platform": "linux/amd64",
      "toolchain": {
        "bun": "1.3.14",
        "rustc": "1.97.1"
      },
      "attributes": {
        "host_class": "developer-workstation"
      }
    }
  },
  "invocation": {
    "commands": [
      "bun run check",
      "just test"
    ],
    "workload": "Foundation smoke: root check and test surface (closed contract fixture, not a gate claim)",
    "budgets": {
      "timeout_seconds": 1200
    },
    "duration_seconds": 180.5,
    "sample_count": 1,
    "warmup_count": 0,
    "variance": "single smoke run"
  },
  "artifacts": [
    {
      "role": "derived",
      "path": "docs/evidence/testdata/payloads/smoke-derived.txt",
      "sha256": "295056d7f17a7a1ff24536fc85ec3dde716dd519f9c49076aa83610c361ea0af",
      "byte_length": 49,
      "media_type": "text/plain",
      "retention_policy": "repository-committed"
    },
    {
      "role": "raw",
      "path": "docs/evidence/testdata/payloads/smoke-raw.json",
      "sha256": "1e421fda91e63790c6a56cb6167f1abcf3f4fa4a2f8d111e63c1c79fac72c4f4",
      "byte_length": 63,
      "media_type": "application/json",
      "retention_policy": "repository-committed"
    }
  ],
  "measurements": {
    "timestamps": {
      "finished_at": "2026-08-12T00:03:00Z",
      "started_at": "2026-08-12T00:00:00Z"
    },
    "queues": {
      "max_depth": 0
    },
    "resources": {
      "peak_rss_mib": 512
    },
    "errors": [],
    "dispositions": [
      {
        "name": "delivered",
        "count": 1
      }
    ]
  },
  "review": {
    "decision": "pending",
    "known_limits": [
      "This smoke report is a closed contract fixture awaiting human review.",
      "It does not qualify a support row or close R0."
    ]
  }
}
